{
  "$schema": "https://json-schema.org/draft/2020-12/schema",
  "$id": "https://tensorleap.local/research/schemas/agent_findings.schema.json",
  "title": "Agent Findings v1",
  "type": "object",
  "required": [
    "schema_version",
    "method_version",
    "experiment_id",
    "repo",
    "inputs",
    "ground_truths",
    "proposed_mapping",
    "unknowns"
  ],
  "properties": {
    "schema_version": { "type": "string", "const": "1.0.0" },
    "method_version": { "type": "string", "const": "pytorch-agent-findings-v1" },
    "experiment_id": { "type": "string", "minLength": 1 },
    "repo": {
      "type": "object",
      "required": ["path"],
      "properties": {
        "path": { "type": "string", "minLength": 1 }
      },
      "additionalProperties": false
    },
    "inputs": {
      "type": "array",
      "items": { "$ref": "#/$defs/candidate" }
    },
    "ground_truths": {
      "type": "array",
      "items": { "$ref": "#/$defs/candidate" }
    },
    "proposed_mapping": {
      "type": "array",
      "items": {
        "type": "object",
        "required": ["encoder_type", "name", "source_candidate", "confidence"],
        "properties": {
          "encoder_type": { "type": "string", "enum": ["input", "ground_truth"] },
          "name": { "type": "string", "minLength": 1 },
          "source_candidate": { "type": "string", "minLength": 1 },
          "confidence": { "type": "string", "enum": ["high", "medium", "low"] },
          "notes": { "type": "string" }
        },
        "additionalProperties": false
      }
    },
    "unknowns": {
      "type": "array",
      "items": { "type": "string", "minLength": 1 }
    },
    "comments": {
      "type": "string"
    }
  },
  "$defs": {
    "candidate": {
      "type": "object",
      "required": ["name", "confidence", "evidence"],
      "properties": {
        "name": { "type": "string", "minLength": 1 },
        "semantic_hint": { "type": "string" },
        "shape_hint": { "type": "string" },
        "dtype_hint": { "type": "string" },
        "confidence": { "type": "string", "enum": ["high", "medium", "low"] },
        "evidence": {
          "type": "array",
          "minItems": 1,
          "items": {
            "type": "object",
            "required": ["file", "line", "snippet"],
            "properties": {
              "file": { "type": "string", "minLength": 1 },
              "line": { "type": "integer", "minimum": 1 },
              "snippet": { "type": "string" }
            },
            "additionalProperties": false
          }
        }
      },
      "additionalProperties": false
    }
  },
  "additionalProperties": false
}
