{
  "schema_version": "1.0.0",
  "method_version": "pytorch-agent-findings-v1",
  "experiment_id": "yolov5_visdrone__pre__framework-leads-v1__r009",
  "repo": {
    "path": ".fixtures/yolov5_visdrone/pre"
  },
  "inputs": [
    {
      "name": "images",
      "confidence": "high",
      "evidence": [
        {
          "file": "utils/dataloaders.py",
          "line": 664,
          "snippet": "img = img.transpose((2, 0, 1))[::-1]  # HWC to CHW, BGR to RGB\nimg = np.ascontiguousarray(img)\nreturn torch.from_numpy(img), labels_out, self.im_files[index], shapes"
        },
        {
          "file": "utils/dataloaders.py",
          "line": 828,
          "snippet": "def collate_fn(batch):\n    im, label, path, shapes = zip(*batch)\n    return torch.stack(im, 0), torch.cat(label, 0), path, shapes"
        },
        {
          "file": "train.py",
          "line": 283,
          "snippet": "for i, (imgs, targets, paths, _) in pbar:\n    imgs = imgs.to(device, non_blocking=True).float() / 255  # uint8 to float32, 0-255 to 0.0-1.0"
        },
        {
          "file": "train.py",
          "line": 309,
          "snippet": "pred = model(imgs)  # forward"
        }
      ],
      "semantic_hint": "Batch of images as a float32 tensor of shape (B, 3, H, W), normalized to [0, 1]. Loaded as BGR, converted to RGB and transposed from HWC to CHW in Dataset.__getitem__. Resized/letterboxed to imgsz (e.g. 640). Divided by 255 in training loop.",
      "shape_hint": "(B, 3, imgsz, imgsz)",
      "dtype_hint": "float32"
    }
  ],
  "ground_truths": [
    {
      "name": "targets",
      "confidence": "high",
      "evidence": [
        {
          "file": "utils/dataloaders.py",
          "line": 660,
          "snippet": "labels_out = torch.zeros((nl, 6))\nif nl:\n    labels_out[:, 1:] = torch.from_numpy(labels)"
        },
        {
          "file": "utils/dataloaders.py",
          "line": 632,
          "snippet": "nl = len(labels)  # number of labels\nif nl:\n    labels[:, 1:5] = xyxy2xywhn(labels[:, 1:5], w=img.shape[1], h=img.shape[0], clip=True, eps=1E-3)"
        },
        {
          "file": "utils/dataloaders.py",
          "line": 828,
          "snippet": "def collate_fn(batch):\n    ...\n    for i, lb in enumerate(label):\n        lb[:, 0] = i  # add target image index for build_targets()\n    return torch.stack(im, 0), torch.cat(label, 0), path, shapes"
        },
        {
          "file": "train.py",
          "line": 310,
          "snippet": "loss, loss_items = compute_loss(pred, targets.to(device))"
        },
        {
          "file": "utils/loss.py",
          "line": 121,
          "snippet": "def __call__(self, p, targets):  # predictions, targets\n    ...\ndef build_targets(self, p, targets):\n    # Build targets for compute_loss(), input targets(image,class,x,y,w,h)\n    na, nt = self.na, targets.shape[0]"
        }
      ],
      "semantic_hint": "Detection targets tensor of shape (N_total, 6) where each row is [image_index, class, x_center, y_center, width, height]. Coordinates are normalized [0,1]. image_index is set by collate_fn to associate targets with images in the batch. Variable number of targets per image; concatenated across the batch.",
      "shape_hint": "(N_total, 6)",
      "dtype_hint": "float32"
    }
  ],
  "proposed_mapping": [
    {
      "encoder_type": "input",
      "name": "unknown",
      "source_candidate": "unknown",
      "confidence": "high",
      "notes": "Map the image tensor (B, 3, H, W) as the model input encoder. Per-sample shape is (3, imgsz, imgsz), uint8 -> float32 / 255."
    },
    {
      "encoder_type": "input",
      "name": "unknown",
      "source_candidate": "unknown",
      "confidence": "high",
      "notes": "Map the detection targets (variable-length per sample, columns: [image_index, class, cx, cy, w, h]) as the ground-truth encoder. Note: image_index column is batch-relative and set by collate_fn; per-sample labels have shape (num_objects, 5) with columns [class, cx, cy, w, h] before collation."
    }
  ],
  "unknowns": [],
  "comments": "This is a standard YOLOv5 repository (Ultralytics) adapted for VisDrone dataset. The framework is unambiguously PyTorch. The primary dataset class is LoadImagesAndLabels which yields (image_tensor, labels_tensor, file_path, shapes) per sample. The collate_fn stacks images into (B,3,H,W) and concatenates variable-length labels into (N_total,6) with a prepended batch-image index. The model receives the image batch directly, and ComputeLoss receives both model predictions (multi-scale feature maps) and the targets tensor. Labels follow YOLO format: [class, cx, cy, w, h] normalized to [0,1]."
}
