{
  "schema_version": "1.0.0",
  "method_version": "pytorch-agent-findings-v1",
  "experiment_id": "webinar__pre__pytorch-leads-v1__r003",
  "repo": {
    "path": ".fixtures/webinar/pre"
  },
  "inputs": [
    {
      "name": "image",
      "confidence": "high",
      "evidence": [
        {
          "file": "webinar/data/preprocess.py",
          "line": 18,
          "snippet": "image_paths.append(str(images_base_path / splitted_line[0]))"
        },
        {
          "file": "webinar/config.yml",
          "line": 13,
          "snippet": "IMAGE_SIZE:\n  - 448\n  - 640"
        },
        {
          "file": "webinar/config.yml",
          "line": 50,
          "snippet": "PIXEL_MEAN: [0, 0, 0]"
        },
        {
          "file": "webinar/utils/metrics.py",
          "line": 51,
          "snippet": "class_list_reshaped, loc_list_reshaped = reshape_output_list(y_pred, decoded=decoded, image_size=CONFIG['IMAGE_SIZE'], feature_maps=CONFIG['FEATURE_MAPS'])"
        },
        {
          "file": "README.md",
          "line": 4,
          "snippet": "The model developed and analyzed is YOLOv7 model."
        },
        {
          "file": "model/yolov7-webinar.h5",
          "line": 1,
          "snippet": "yolov7-webinar.h5"
        }
      ],
      "semantic_hint": "RGB image frame from an ADAS front-facing (or fisheye) camera, preprocessed for YOLOv7 inference. Image paths are resolved via GCS download and passed as the primary model input.",
      "shape_hint": "[448, 640, 3]",
      "dtype_hint": "float32"
    }
  ],
  "ground_truths": [
    {
      "name": "bbox_labels",
      "confidence": "high",
      "evidence": [
        {
          "file": "webinar/data/preprocess.py",
          "line": 19,
          "snippet": "list_of_bounding_boxes = [word.split(',') for word in splitted_line[1:]]"
        },
        {
          "file": "webinar/data/preprocess.py",
          "line": 23,
          "snippet": "label_data.append(list_of_bounding_boxes_int)"
        },
        {
          "file": "webinar/config.yml",
          "line": 9,
          "snippet": "MAX_BB_PER_IMAGE: 150"
        },
        {
          "file": "webinar/utils/metrics.py",
          "line": 108,
          "snippet": "gt_loc, gt_class = true_coords_labels(batch_i, y_true, BACKGROUND_LABEL)"
        },
        {
          "file": "webinar/utils/metrics.py",
          "line": 113,
          "snippet": "ious = jaccard(outputs[batch_i][:, 1:5], xywh_to_xyxy_format(tf.cast(gt_loc, tf.double))).numpy()"
        },
        {
          "file": "webinar/utils/metrics.py",
          "line": 20,
          "snippet": "BACKGROUND_LABEL = CLASSES + 1"
        },
        {
          "file": "webinar/utils/metrics.py",
          "line": 39,
          "snippet": "LOSS_FN = YoloLoss(num_classes=CLASSES, ..., default_boxes=DEFAULT_BOXES, background_label=BACKGROUND_LABEL, ...)"
        },
        {
          "file": "webinar/utils/metrics.py",
          "line": 54,
          "snippet": "loss_l, loss_c, loss_o = LOSS_FN(y_true=y_true, y_pred=(loc_list_reshaped, class_list_reshaped))"
        }
      ],
      "semantic_hint": "Per-image padded ground-truth bounding box tensor for object detection. Each row encodes one object as [x_center_norm, y_center_norm, width_norm, height_norm, class_id]; empty slots are padded with background_label (=4). Derived from the raw annotation list returned by generate_subset().",
      "shape_hint": "[150, 5]",
      "dtype_hint": "float32"
    }
  ],
  "proposed_mapping": [
    {
      "encoder_type": "input",
      "name": "input_image_encoder",
      "source_candidate": "image",
      "confidence": "medium"
    },
    {
      "encoder_type": "ground_truth",
      "name": "gt_bbox_encoder",
      "source_candidate": "bbox_labels",
      "confidence": "medium"
    }
  ],
  "unknowns": [
    "The raw annotation file format (splitted_line[1:] fields) is parsed as integers but the exact coordinate convention \u2014 xyxy pixel, xywh pixel, or already normalized \u2014 is not confirmed by in-repo code. The inference that raw format is xyxy-pixel (needing conversion to xywh-normalized for y_true) is derived from xywh_to_xyxy_format usage in metrics.py but the conversion step itself is not shown in preprocess.py.",
    "PIXEL_MEAN=[0,0,0] suggests [0,1] normalization, but no explicit normalization transform is coded in preprocess.py. The exact scaling (divide by 255 vs torchvision default vs model-internal) cannot be confirmed without seeing the missing leap_binder.py encoder.",
    "leap_binder.py is missing from the 'pre' variant (only a compiled .pyc artifact exists in __pycache__). No @tensorleap_input or @tensorleap_gt decorator evidence is available in source form. All encoder mapping is inferred from metrics/loss signatures and preprocess utilities alone.",
    "No DataLoader, Dataset subclass, or training loop exists in the scanned Python files. The lead scanner found zero primary-tier signals. Confidence in input/GT shapes relies on config.yml and loss/metric function signatures rather than direct batch-unpacking evidence.",
    "y_pred is passed through reshape_output_list before loss computation. The raw model output structure (number of YOLO heads, per-head tensor shape) is not fully traceable from available source \u2014 only the 3 feature map scales [14\u00d720, 28\u00d740, 56\u00d780] are known from config.yml."
  ]
}
